data_source,URL,collection_method,level_of_detail,level_of_detail_note,speed_of_fetch,speed_of_fetch_note,update_frequency,use_case
AFL website,https://www.afl.com.au/,API,High,All the advanced stats you would want including centre bounce attendences and kick-ins,Slow,Data is very fragmented and thus the api needs to be hit many times if you want a full season of data,Live,More advanced stats such as centre bounce attendances
AFL Tables,https://afltables.com/afl/afl_index.html,Web Scraping,Moderate,All the basic stats you might want but doesn't include disposal efficiency for example,Varies,Some data is stored on github (in which case it is reasonably fast) but other data may require the webscraping process to be run which is slow,End of round,Full AFL History with ability to look at the game on a web page
Footywire,https://www.footywire.com/,Web Scraping,High,Less data than AFL Website but some interesting unique data such as historical betting odds,Varies,Some data is stored on github (in which case it is reasonably fast) but other data may require the webscraping process to be run which is slow,End of round,More unique data such as historical betting odds
Squiggle,https://api.squiggle.com.au/,API,Low,Intentionally minimal,Fast,"Indended to be fast, appears to be an api that just queries a database",Live,"Fast, live AFL data"
Fryzigg,https://twitter.com/fryzigg?lang=en,API,High,Contains almost all the player stats from the AFL Website,Fast,Appears to be an api that just queries a database,End of round,Full AFL History with more detailed stats
